{
 "run_id": "test-B-bge-m3",
 "split": "test",
 "variant": "B",
 "k": 10,
 "git_commit": "6129078f26fc929604673c14d5fa20b4a37cac4f",
 "git_dirty": false,
 "config_path": "config.json",
 "config_sha256": "4edf6f628a3606ab03ddf7fd0ead941cf907a0b3e0223ff2337d9dc887908066",
 "corpus_version": "normalized-v12",
 "corpus_inventory_sha256": "1862de303a1a44797a9d02697fffbf74efc3695ce540feba017d40d911ec42b9",
 "chunk_config_id": "chunks-v12-t512-t512-h1-m1",
 "chunks_sha256": "4beb721e181b5ef344754b37479fecda1874657b889bdeca4502d4e8ec31088c",
 "embedding_model": {
  "name": "BAAI/bge-m3",
  "revision": "5617a9f61b028005a4858fdac845db406aefb181"
 },
 "bm25": {
  "tokenizer": "char3",
  "dictionary": null,
  "k1": 2.18,
  "b": 0.86,
  "library": "bm25s 0.3.12",
  "variant": "lucene",
  "text": "header_text + text"
 },
 "fusion": {
  "type": "convex",
  "alpha": 0.6,
  "normalisation": "min-max"
 },
 "index_sha256": "ff5effce8de382f81cd9071515306f887003fba49a92ff1d91636799a9bef09a",
 "questions_sha256": "680a752e738d7a60f463345c08e3e098934ab945df2183a8bb1e0d97b1f6ddea",
 "results_sha256": "c588946442a010e1e8ddfc70507a0e3d150aa6c769ea999d1c31324f7147a223",
 "device": "cuda",
 "machine": "Intel64 Family 6 Model 189 Stepping 1, GenuineIntel",
 "python": "3.12.13",
 "packages": {
  "torch": "2.14.1",
  "sentence-transformers": "6.1.0",
  "transformers": "5.18.0",
  "numpy": "2.5.3"
 },
 "started_at": "2026-10-10T19:09:13.816094Z",
 "finished_at": "2026-10-10T19:09:51.131674Z",
 "n_questions": 56,
 "notes": "T2 hybrid, frozen_v1 | device field corrected from \"mixed\" to \"cuda\" after the run: the v12 index reuses GPU float16 vectors only (0 computed on CPU); results unchanged"
}