{
 "run_id": "test-A-bge-m3",
 "split": "test",
 "variant": "A",
 "k": 10,
 "git_commit": "6129078f26fc929604673c14d5fa20b4a37cac4f",
 "git_dirty": false,
 "config_path": "config.json",
 "config_sha256": "0273d47da63c9499f397ed293d8e1343efe71e5026e556fcbd21930740f667d9",
 "corpus_version": "normalized-v12",
 "corpus_inventory_sha256": "1862de303a1a44797a9d02697fffbf74efc3695ce540feba017d40d911ec42b9",
 "chunk_config_id": "chunks-v12-t512-t512-h1-m1",
 "chunks_sha256": "4beb721e181b5ef344754b37479fecda1874657b889bdeca4502d4e8ec31088c",
 "embedding_model": {
  "name": "BAAI/bge-m3",
  "revision": "5617a9f61b028005a4858fdac845db406aefb181"
 },
 "bm25": null,
 "fusion": null,
 "index_sha256": "ff5effce8de382f81cd9071515306f887003fba49a92ff1d91636799a9bef09a",
 "questions_sha256": "680a752e738d7a60f463345c08e3e098934ab945df2183a8bb1e0d97b1f6ddea",
 "results_sha256": "ab928831091b130ae9b3cd58ed4a883262403980e17567a8f24ce4cf35e46005",
 "device": "cuda",
 "machine": "Intel64 Family 6 Model 189 Stepping 1, GenuineIntel",
 "python": "3.12.13",
 "packages": {
  "torch": "2.14.1",
  "sentence-transformers": "6.1.0",
  "transformers": "5.18.0",
  "numpy": "2.5.3"
 },
 "started_at": "2026-10-10T19:08:36.406272Z",
 "finished_at": "2026-10-10T19:09:11.914161Z",
 "n_questions": 56,
 "notes": "T1 dense parent-child, frozen_v1 | device field corrected from \"mixed\" to \"cuda\" after the run: the v12 index reuses GPU float16 vectors only (0 computed on CPU); results unchanged"
}